<?xml version="1.0" encoding="UTF-8"?>
<extb:ExtensionBundle
	name="bundle04"
	version="1.0"
	xmlns:extb="www.easytag.de/XMLSchema_v1_0"
   xmlns:xsi="http://www.w3.org/2001/XMLSchema-instance"
   xsi:schemaLocation="www.easytag.de/XMLSchema_v1_0 ExtensionBundleConfiguration.xsd">

   <!-- The basic properties of the bundle -->
	<BundleProperties>
		<Name>My FOURTH bundle</Name>
		<Description>My fourth description</Description>
		<Author>J. E.</Author>
		<Date>2011-01-05</Date>
		<Version>12er124efqwe</Version>
		<Type>CUSTOM</Type>
	</BundleProperties>

   <!-- List of all extensions in the bundle -->
	<BundledExtensions>
		<Extension id="D1">
			<ExtensionPointId>x2</ExtensionPointId>
			<Provider>de.je.jmeta.extmanager.test.bundle004.a.MyOtherTestImple</Provider>
			<RelativePath>../../../../target/classes</RelativePath>
		</Extension>
		<Extension id="D2">
			<ExtensionPointId>x1</ExtensionPointId>
			<Provider>de.je.jmeta.extmanager.test.bundle004.a.TestImplCompA1</Provider>
			<RelativePath>../../../../target/classes</RelativePath>
		</Extension>
		<Extension id="D3">
			<ExtensionPointId>x4</ExtensionPointId>
			<Provider>de.je.jmeta.extmanager.test.bundle004.c.TestIMPLCompC1</Provider>
			<RelativePath>../../../../target/classes</RelativePath>
		</Extension>
		<Extension id="D4">
			<ExtensionPointId>x5</ExtensionPointId>
			<Provider>de.je.jmeta.extmanager.test.bundle004.d.XYZImpl222</Provider>
			<RelativePath>../../../../target/classes</RelativePath>
		</Extension>
	</BundledExtensions>

</extb:ExtensionBundle>