<?xml version="1.0" encoding="UTF-8"?>
<extb:ExtensionBundle
	name="bundle03"
	version="1.0"
	xmlns:extb="www.easytag.de/XMLSchema_v1_0"
   xmlns:xsi="http://www.w3.org/2001/XMLSchema-instance"
   xsi:schemaLocation="www.easytag.de/XMLSchema_v1_0 ExtensionBundleConfiguration.xsd">

   <!-- The basic properties of the bundle -->
	<BundleProperties>
		<Name>My third bundle</Name>
		<Description>My third description</Description>
		<Author>J. E.</Author>
		<Date>2011-01-04</Date>
		<Version>0.3</Version>
		<Type>DEFAULT</Type>
	</BundleProperties>

   <!-- List of all extensions in the bundle -->
	<BundledExtensions>
		<Extension id="C1">
			<ExtensionPointId>x3</ExtensionPointId>
			<Provider>de.je.jmeta.extmanager.test.bundle003.b.TestIMPLEMENTOR</Provider>
			<RelativePath>../../../../target/classes</RelativePath>
		</Extension>
		<Extension id="C2">
			<ExtensionPointId>x5</ExtensionPointId>
			<Provider>de.je.jmeta.extmanager.test.bundle003.d.XYZImpl1</Provider>
			<RelativePath>../../../../target/classes</RelativePath>
		</Extension>
		<Extension id="C3">
			<ExtensionPointId>x5</ExtensionPointId>
			<Provider>de.je.jmeta.extmanager.test.bundle003.d.XYZImpl2</Provider>
			<RelativePath>../../../../target/classes</RelativePath>
		</Extension>
		<Extension id="C4">
			<ExtensionPointId>x5</ExtensionPointId>
			<Provider>de.je.jmeta.extmanager.test.bundle003.d.XYZImpl3</Provider>
			<RelativePath>../../../../target/classes</RelativePath>
		</Extension>
	</BundledExtensions>

</extb:ExtensionBundle>